{
  "snapshot_id": "alfred-cpi-20260910-demo",
  "source_id": "alfred",
  "request_url": "https://api.stlouisfed.org/fred/series/observations",
  "request_params": {"series_id": "CPIAUCSL", "realtime_start": "2026-09-10", "realtime_end": "2026-09-10"},
  "retrieved_at": "2026-09-10T12:31:00+00:00",
  "response_status": 200,
  "content_type": "application/json",
  "response_hash": "sha256:demo-fred-response-001",
  "snapshot_hash": "sha256:demo-fred-vintage-001",
  "raw_file": "artifacts/snapshots/alfred/alfred-cpi-20260910-demo.raw",
  "parser_version": "fred_json_realtime_period",
  "provider_version": "fred-api-v1",
  "access_method": "api",
  "source_authority": "federal_reserve",
  "authorization_status": "authorized",
  "point_in_time_status": "pass",
  "revision_status": "vintage_aware",
  "observation_date": "2026-08-01",
  "release_date": "2026-09-10",
  "availability_date": "2026-09-10",
  "vintage_date": "2026-09-10",
  "license": "FRED terms of use",
  "cache_expiry": null,
  "fallback_used": false
}
